### ISSUE TITLE
systemctl stop bluechi-agent is not working

### ISSUE THREAD

**Issue by dougsland** [engelmi/hirte#702]
## Describe the bug

My test environment contain 4 nodes, 1 controller and 3 additional agent nodes.

Let's check the current status of the agent:
```
[root@node2 ~]# systemctl status bluechi-agent
● bluechi-agent.service - BlueChi systemd service controller agent daemon
     Loaded: loaded (/usr/lib/systemd/system/bluechi-agent.service; enabled; preset: disabled)
     Active: active (running) since Mon 2024-01-15 20:55:23 UTC; 12s ago
       Docs: man:bluechi-agent(1)
             man:bluechi-agent.conf(5)
   Main PID: 528 (bluechi-agent)
      Tasks: 1 (limit: 1638)
     Memory: 472.0K
        CPU: 4ms
     CGroup: /system.slice/bluechi-agent.service
             └─528 /usr/libexec/bluechi-agent

Jan 15 20:55:23 node2 systemd[1]: Started BlueChi systemd service controller agent daemon.
Jan 15 20:55:23 node2 bluechi-agent[528]: Starting bluechi-agent 0.7.0-0.202311161313.git
Jan 15 20:55:23 node2 bluechi-agent[528]: Connecting to manager on tcp:host=10.90.0.2,port=842
Jan 15 20:55:23 node2 bluechi-agent[528]: Connected to manager as 'node2'
```

Ok running, now let's stop the service and check the output:
```
[root@node2 ~]# systemctl stop bluechi-agent
[root@node2 ~]# systemctl status bluechi-agent
○ bluechi-agent.service - BlueChi systemd service controller agent daemon
     Loaded: loaded (/usr/lib/systemd/system/bluechi-agent.service; enabled; preset: disabled)
     Active: inactive (dead) since Mon 2024-01-15 20:55:40 UTC; 1s ago
   Duration: 17.433s
       Docs: man:bluechi-agent(1)
             man:bluechi-agent.conf(5)
    Process: 528 ExecStart=/usr/libexec/bluechi-agent (code=exited, status=0/SUCCESS)
   Main PID: 528 (code=exited, status=0/SUCCESS)
        CPU: 5ms
```

Great, inactive, however, I still see the process there:
```
[root@node2 ~]# ps aux | grep -i bluechi-agent
root        2231  0.0  0.0   6500  3520 ?        Ss   20:56   0:00 /usr/libexec/bluechi-agent
root        2636  0.0  0.0   3900  2240 pts/0    S+   21:01   0:00 grep --color=auto -i bluechi-agent
```

still see active in the tcpdump as well (running in the controller):
```
[root@control ~]# sudo tcpdump host 10.90.0.4 and port 842
dropped privs to tcpdump
tcpdump: verbose output suppressed, use -v[v]... for full protocol decode
listening on eth0, link-type EN10MB (Ethernet), snapshot length 262144 bytes
21:05:54.403695 IP control.842 > 10.90.0.4.54982: Flags [.], ack 3846430692, win 501, options [nop,nop,TS val 535797777 ecr 166244159], length 0
21:05:54.403712 IP 10.90.0.4.54982 > control.842: Flags [.], ack 1, win 535, options [nop,nop,TS val 166245223 ecr 535796713], length 0
21:05:54.403720 IP control.842 > 10.90.0.4.54982: Flags [.], ack 1, win 501, options [nop,nop,TS val 535797777 ecr 166244159], length 0
21:05:54.403747 IP 10.90.0.4.54982 > control.842: Flags [.], ack 1, win 535, options [nop,nop,TS val 166245223 ecr 535797777], length 0
21:05:54.583836 IP 10.90.0.4.54982 > control.842: Flags [P.], seq 1:137, ack 1, win 535, options [nop,nop,TS val 166245403 ecr 535797777], length 136
21:05:54.583848 IP control.842 > 10.90.0.4.54982: Flags [.], ack 137, win 501, options [nop,nop,TS val 535797957 ecr 166245403], length 0
21:05:55.587707 IP 10.90.0.4.54982 > control.842: Flags [.], ack 1, win 535, options [nop,nop,TS val 166246407 ecr 535797957], length 0
21:05:55.587715 IP control.842 > 10.90.0.4.54982: Flags [.], ack 137, win 501, options [nop,nop,TS val 535798961 ecr 166245403], length 0
21:05:55.588301 IP control.842 > 10.90.0.4.54982: Flags [.], ack 137, win 501, options [nop,nop,TS val 535798961 ecr 166245403], length 0
21:05:55.588337 IP 10.90.0.4.54982 > control.842: Flags [.], ack 1, win 535, options [nop,nop,TS val 166246407 ecr 535798961], length 0
^C
10 packets captured
10 packets received by filter
0 packets dropped by kernel
```

Anyone seeing it as well?

**Comment by dougsland** [comment]
version in the controller:
```
[root@control ~]# rpm -qa | grep -i bluechi
bluechi-selinux-0.7.0-0.202311161311.git843317a.el9.x86_64
bluechi-controller-0.7.0-0.202311161311.git843317a.el9.x86_64
bluechi-ctl-0.7.0-0.202311161311.git843317a.el9.x86_64
bluechi-agent-0.7.0-0.202311161311.git843317a.el9.x86_64
```

version in the agent:
```
[root@node2 ~]# rpm -qa | grep -i bluechi
bluechi-selinux-0.7.0-0.202311161311.git843317a.el9.x86_64
bluechi-controller-0.7.0-0.202311161311.git843317a.el9.x86_64
bluechi-ctl-0.7.0-0.202311161311.git843317a.el9.x86_64
bluechi-agent-0.7.0-0.202311161311.git843317a.el9.x86_64
```

**Comment by dougsland** [comment]
in a fresh deploy, I noticed:

```
[root@node2 ~]# ps aux | grep -i bluechi
root         240  0.0  0.0   6484  3680 ?        Ss   22:43   0:00 /usr/libexec/bluechi-agent
root         345  0.0  0.0   6352  3680 ?        Ss   22:43   0:00 /usr/libexec/bluechi-agent
root         470  0.0  0.0   3764  1920 pts/0    S+   22:43   0:00 grep --color=auto -i bluechi
```

Which means we have 2 agent processes running, so `systemctl stop bluechi-agent` only stop one of these processes.

**Comment by engelmi** [comment]
I wasn't able to reproduce this, but I noticed that you are using a BlueChi version from 2023-11-16. Could you retry this with the newest version? @dougsland

**Comment by dougsland** [comment]
> I wasn't able to reproduce this, but I noticed that you are using a BlueChi version from 2023-11-16. Could you retry this with the newest version? @dougsland

@engelmi sure, wow, not sure why the e2e didn't get the latest. Going to keep digging here. thanks !

**Comment by dougsland** [comment]
Going to close this one in BlueChi side. I am assuming it's something in QM e2e environment.
